text,category
Help. may patay na daga s daan s Bicol Central Station. Pls fix.,sanitation
Kailan po kaya maayos ang LCC Mall? tricycle overcharging fare po kasi.,traffic
Help. wala pa kaming natatnggap na ayuda s Ateneo Avenue. Pls fix.,social_services
Pwede ba mag-reklamo? sobrang dilim ng eskinita kasi sa Balatas. Thanks.,public_safety
Good day. We are requesting assistance because discrimination sa hiring process at Centro.,employment
Pwede ba mag-reklamo? no entry violation reports kasi sa San Francisco. Thanks.,traffic
Fyi meter reading error complaint s Tabuco.,utilities
To the City Government: looking for summer job for students here in Peñafrancia. Please investigate.,employment
"Grabe naman, flu outbreak sa area namin dito sa Sabang! Ano na??",health
Please be informed that medical certificate request for indigent in the vicinity of Concepcion Pequeña.,health
Parang wala namang action. may magnanakaw na umaaligid pa rin sa Sabang.,public_safety
Concern lng re: road rage incident report s San Felipe.,traffic
Urgent: falling debris from construction d2 s Santa Cruz.,infrastructure
"Kami po ay taga Dinaga, report ko lang na sira ang traffic light.",traffic
Concern lng re: clogged drainage causing smell s Dayngdng.,sanitation
Help. diarrhea outbreak due to dirty water s Peñafrancia. Pls fix.,health
fyi openings for construction workers s liboton.,employment
"GRABE NAMAN, HIGH BLOOD PRESSURE MONITORING REQUEST DITO SA PANICUASON! ANO NA??",health
"Ask ko lang po kung may action na, discrimination sa hiring process kasi dito sa Cararayan.",employment
"Jusko, double parking sa main road nanaman sa San Isidro. Ilang araw na to.",traffic
Pwede ba mag-reklamo? akyat bahay incident report kasi sa San Francisco. Thanks.,public_safety
Kailan po kaya maayos ang Balatas? no entry violation reports po kasi.,traffic
"Sir/Ma'am, pa-check naman po ng Dayangdang, openings for construction workers po kasi.",employment
fyi defective solar lights s lcc mall.,infrastructure
"Ask ko lang po kung may action na, kailan ang schedule ng hakot kasi dito sa San Isidro.",waste_management
Pwede ba mag-reklamo? estero needs cleaning kasi sa Triangulo. Thanks.,sanitation
Parang wala namang action. wala pa kaming natatanggap na ayuda pa rin sa Sabang.,social_services
Fyi livelihood program for mothers s Balatas.,employment
Reporting a concern regarding kulang ang binigay na relief goods at Tinago.,social_services
PLEASE BE INFORMED THAT NEED OXYGEN TANK ASSISTANCE IN THE VICINITY OF CONCEPCION PEQUEÑA.,health
Huy pansinin niyo naman to. may nag-aaway na lasing sa Centro. Nakaka-stress!,public_safety
Formal complaint: suspicious person taking photos located in UNC gate.,public_safety
Huy pansinin niyo naman to. livelihood program for mothers sa Bicol Central Station. Nakaka-stress!,employment
Urgent: unfair labor practice s trabaho d2 s SM Naga area.,employment
Pwede ba mag-reklamo? kailan ang schedule ng hakot kasi sa Diversion Road. Thanks.,waste_management
I would like to report that tambak na basura sa kalsada in Plaza Rizal.,sanitation
Magtatanong lang po regarding gang war threat sa Concepcion Grande?,public_safety
Huy pansinin niyo naman to. loading/unloading violation sa San Isidro. Nakaka-stress!,traffic
"Ask ko lang po kung may action na, unsanitary street food vendors kasi dito sa San Isidro.",sanitation
Fyi basura nakatambak s harap ng school s Abella.,sanitation
"Ask ko lang po kung may action na, wala pa kaming natatanggap na ayuda kasi dito sa Calauag.",social_services
Good day. We are requesting assistance because road widening project delay at Magsaysay Avenue.,infrastructure
Gud pm. may putol na kable s daan s Bagumbayan. Tnx.,utilities
Good day. We are requesting assistance because unsanitary street food vendors at Bicol Central Station.,sanitation
"Grabe naman, slippery pathway due to moss dito sa Del Rosario! Ano na??",infrastructure
Help. livelihood program for mothers s Sabng. Pls fix.,employment
Gud pm. sumabog ng transformer s Dinaga. Tnx.,utilities
Please be informed that pagtapon ng basura sa ilog in the vicinity of UNC gate.,waste_management
"sir/ma'am, pa-check naman po ng naga city people's mall, requesting ambulance assistance po kasi.",health
To the City Government: traffic rerouting confusion here in Liboton. Please investigate.,traffic
"Ask ko lang po kung may action na, sira ang tulay, delikado kasi dito sa Metropolitan Cathedral.",infrastructure
PLEASE BE INFORMED THAT IPIS INFESTATION SA PUBLIC MARKET IN THE VICINITY OF NAGA CITY PEOPLE'S MALL.,sanitation
"Shoutout sa LGU, sobrang hina ng signal sa Lerma. Please actionan agad.",utilities
"Jusko, tumataas ang cases ng dengue nanaman sa Igualdad. Ilang araw na to.",health
To the City Government: road widening project delay here in Peñafrancia. Please investigate.,infrastructure
Help. kulng ng binigay na relief goods s Balatas. Pls fix.,social_services
Gud pm. clogged drainage causing smell s Plaza Quince. Tnx.,sanitation
Gud pm. unsnitary street food vendors s Bicol Central Station. Tnx.,sanitation
Reporting a concern regarding penalty for littering inquiry at Plaza Quince.,waste_management
Good day. We are requesting assistance because traffic enforcer nangongotong at Liboton.,traffic
"Concerned lang po kami sa mga bata, nakatagilid na ang poste dito sa San Francisco.",infrastructure
Kailan po kaya maayos ang Plaza Quince? stray dogs chasing people po kasi.,health
Reporting a concern regarding puno na ang septic tank at Calauag.,sanitation
Kailan po kaya maayos ang SM Naga area? defective solar lights po kasi.,infrastructure
To the City Government: meter reading error complaint here in Ateneo Avenue. Please investigate.,utilities
"Sir/Ma'am, pa-check naman po ng Concepcion Pequeña, ipis infestation sa public market po kasi.",sanitation
Anyone from city hall? schedule ng tuli operation here in Balatas. So hassle.,health
Reporting a concern regarding public toilet walang tubig at madumi at Panganiban Drive.,sanitation
"Sir/Ma'am, pa-check naman po ng Naga City People's Mall, akyat bahay incident report po kasi.",public_safety
Urgent: vandalism s pader ng school d2 s Balatas.,public_safety
"ask ko lang po kung may action na, naghahanap ng trabaho kasi dito sa cararayan.",employment
To the City Government: road rage incident report here in Concepcion Pequeña. Please investigate.,traffic
"GRABE NAMAN, DUMI NG ASO SA SIDEWALK DITO SA CALAUAG! ANO NA??",sanitation
Good day. We are requesting assistance because curfew violation ng mga minor at LCC Mall.,public_safety
Formal complaint: contractualization issue located in UNC gate.,employment
magtatanong lang po regarding inom sa kalsada hanggang madaling araw sa abella?,public_safety
Help. penalty for littering inquiry s Calauag. Pls fix.,waste_management
Kailan po kaya maayos ang Mabolo? jeepney cutting trip violation po kasi.,traffic
Urgent: may magnanakaw na umaaligid d2 s Naga City People's Mall.,public_safety
Gud pm. suspicious drug related activity s Lerma. Tnx.,public_safety
I would like to report that paano kumuha ng pwd id in Bagumbayan.,social_services
Formal complaint: kalat ang basura sa park located in Centro.,waste_management
Formal complaint: pagtapon ng basura sa ilog located in Balatas.,waste_management
Please be informed that walang benefits na binibigay in the vicinity of Ecology Park.,employment
Anyone from city hall? fluctuating ang kuryente here in Carolina. So hassle.,utilities
"Parang wala namang action. daming lamok, need fumigation pa rin sa Plaza Quince.",health
Good day. We are requesting assistance because nagkalat na used face masks at Dayangdang.,sanitation
Fyi sira ng bubong ng waiting shed s Igualdad.,infrastructure
Kailan po kaya maayos ang Liboton? unpaid overtime pay po kasi.,employment
Parang wala namang action. status of scholarship application pa rin sa Centro.,social_services
"Sir/Ma'am, pa-check naman po ng Naga City People's Mall, may putol na kable sa daan po kasi.",utilities
Please be informed that lost id replacement process in the vicinity of Tinago.,social_services
Concern lng re: traffic enforcer nngongotong s Jesse Robredo Coliseum.,traffic
Help. grabe ng traffic ngayon s Tabuco. Pls fix.,traffic
Urgent: slippery pathway due to moss d2 s Calauag.,infrastructure
To the City Government: stray dogs chasing people here in Mabolo. Please investigate.,health
"Ask ko lang po kung may action na, walang doctor sa health center kasi dito sa Carolina.",health
Parang wala namang action. snatching incident sa kanto pa rin sa Concepcion Grande.,public_safety
"Ask ko lang po kung may action na, fluctuating ang kuryente kasi dito sa Plaza Rizal.",utilities
To the City Government: snatching incident sa kanto here in San Francisco. Please investigate.,public_safety
Urgent: traffic enforcer nngongotong d2 s Bagumbayan.,traffic
Concern lng re: defective solar lights s Dayngdng.,infrastructure
"Grabe naman, requesting police visibility dito sa Bagumbayan! Ano na??",public_safety
Formal complaint: maraming bata ang nilalagnat located in Metropolitan Cathedral.,health
Kailan po kaya maayos ang Mabolo? wala pa kaming natatanggap na ayuda po kasi.,social_services
Pwede ba mag-reklamo? ang lalim ng lubak sa daan kasi sa Sabang. Thanks.,infrastructure
Pwede ba mag-reklamo? mabaho ang poultry sa residential area kasi sa Triangulo. Thanks.,sanitation
Report ko lng tanod sleeping on duty d2 s Plaza Quince.,public_safety
Reporting a concern regarding double parking sa main road at Bagumbayan.,traffic
I would like to report that tanod sleeping on duty in Panicuason.,public_safety
To the City Government: may magnanakaw na umaaligid here in Bagumbayan. Please investigate.,public_safety
To the City Government: inquiry for DOLE TUPAD program here in Naga City People's Mall. Please investigate.,employment
"Concerned lang po kami sa mga bata, flu outbreak sa area namin dito sa Plaza Quince.",health
Huy pansinin niyo naman to. ang lalim ng lubak sa daan sa Plaza Quince. Nakaka-stress!,infrastructure
formal complaint: walang garbage collector personnel located in santa cruz.,waste_management
"Concerned lang po kami sa mga bata, puno na ang septic tank dito sa Pacol.",sanitation
I would like to report that medical certificate request for indigent in Sabang.,health
Help. gng war threat s Tringulo. Pls fix.,public_safety
MAGTATANONG LANG PO REGARDING FEEDING PROGRAM REQUEST FOR KIDS SA BICOL CENTRAL STATION?,social_services
"kami po ay taga igualdad, report ko lang na clogged drainage causing smell.",sanitation
Fyi financial aid for poor students s Magsysy Avenue.,social_services
"Shoutout sa LGU, shocking electricity bill amount sa Santa Cruz. Please actionan agad.",utilities
Good day. We are requesting assistance because requesting ambulance assistance at Cararayan.,health
Magtatanong lang po regarding calamity loan inquiry sa Plaza Rizal?,social_services
I would like to report that vandalism sa pader ng school in Diversion Road.,public_safety
"Grabe naman, brownout nanaman dito dito sa Panganiban Drive! Ano na??",utilities
Please be informed that dumi ng aso sa sidewalk in the vicinity of Plaza Rizal.,sanitation
To the City Government: flu outbreak sa area namin here in LCC Mall. Please investigate.,health
"Ask ko lang po kung may action na, illegal parking sa kalsada kasi dito sa Balatas.",traffic
I would like to report that delayed ang sweldo ng workers in SM Naga area.,employment
Gud pm. walng doctor s health center s Jesse Robredo Coliseum. Tnx.,health
Good day. We are requesting assistance because feeding program request for kids at Jesse Robredo Coliseum.,social_services
"shoutout sa lgu, unpaid overtime pay sa naga city people's mall. please actionan agad.",employment
Kailan po kaya maayos ang San Felipe? mabaho ang poultry sa residential area po kasi.,sanitation
Formal complaint: openings for construction workers located in Carolina.,employment
"Kami po ay taga Jesse Robredo Coliseum, report ko lang na nagkalat na used face masks.",sanitation
"Sir/Ma'am, pa-check naman po ng Centro, inquiry for DOLE TUPAD program po kasi.",employment
Gud pm. road widening project delay s Metropolitan Cathedral. Tnx.,infrastructure
Pwede ba mag-reklamo? double parking sa main road kasi sa LCC Mall. Thanks.,traffic
"jusko, counter-flow na tricycle nanaman sa magsaysay avenue. ilang araw na to.",traffic
Huy pansinin niyo naman to. tambak na basura sa kalsada sa Del Rosario. Nakaka-stress!,sanitation
Urgent: may putol na kable s daan d2 s UNC gate.,utilities
Parang wala namang action. composting facility foul odor pa rin sa Igualdad.,waste_management
Magtatanong lang po regarding estero needs cleaning sa Plaza Rizal?,sanitation
Formal complaint: openings for construction workers located in UNC gate.,employment
Concern lng re: low water pressure tuwing umaga s Dinaga.,utilities
"Urgent: sira ng tulay, delikado d2 s Tinago.",infrastructure
Magtatanong lang po regarding cctv camera not working sa Tinago?,infrastructure
Pwede ba mag-reklamo? dumi ng aso sa sidewalk kasi sa Lerma. Thanks.,sanitation
To the City Government: senior citizen pension delay here in Peñafrancia. Please investigate.,social_services
"Kami po ay taga Triangulo, report ko lang na sumabog ang transformer.",utilities
Reporting a concern regarding kulang ang binigay na relief goods at Plaza Rizal.,social_services
Urgent: lost id replacement process d2 s Cararayan.,social_services
Reporting a concern regarding nagkalat na used face masks at Igualdad.,sanitation
Concern lng re: unpaid overtime pay s Carolina.,employment
please be informed that livelihood program for mothers in the vicinity of igualdad.,employment
"Sir/Ma'am, pa-check naman po ng Panicuason, kailan ang next job fair po kasi.",employment
Urgent: colorum vehicles operating d2 s Ateneo Avenue.,traffic
Kailan po kaya maayos ang Abella? financial aid for poor students po kasi.,social_services
"Kami po ay taga San Isidro, report ko lang na illegal parking sa kalsada.",traffic
Urgent: slippery pathway due to moss d2 s Balatas.,infrastructure
Formal complaint: kailan ang schedule ng hakot located in Balatas.,waste_management
FORMAL COMPLAINT: PUNO NA ANG SEPTIC TANK LOCATED IN ECOLOGY PARK.,sanitation
Formal complaint: riot ng mga kabataan kagabi located in UNC gate.,public_safety
"grabe naman, illegal dumping site sa vacant lot dito sa plaza rizal! ano na??",waste_management
"Shoutout sa LGU, defective solar lights sa Ateneo Avenue. Please actionan agad.",infrastructure
Formal complaint: tesda training schedule inquiry located in San Felipe.,employment
Huy pansinin niyo naman to. need namin ng schedule for anti-rabies sa Mabolo. Nakaka-stress!,health
please be informed that illegal jumper connection report in the vicinity of liboton.,utilities
Report ko lng may putol na kable s daan d2 s San Francisco.,utilities
"Shoutout sa LGU, unannounced water interruption sa Bicol Central Station. Please actionan agad.",utilities
Help. counter-flow na tricycle s Pnganiban Drive. Pls fix.,traffic
"Jusko, looking for summer job for students nanaman sa San Felipe. Ilang araw na to.",employment
To the City Government: basura bumabara sa drainage here in Pacol. Please investigate.,waste_management
CONCERN LNG RE: CURFEW VIOLATION NG MGA MINOR S METROPOLITAN CATHEDRAL.,public_safety
Anyone from city hall? brownout nanaman dito here in San Francisco. So hassle.,utilities
I would like to report that water pipe leak sa kalsada in Ecology Park.,utilities
"Jusko, high blood pressure monitoring request nanaman sa San Isidro. Ilang araw na to.",health
"Help. busted ng street lights, madilim s Calauag. Pls fix.",infrastructure
"Concerned lang po kami sa mga bata, inom sa kalsada hanggang madaling araw dito sa Igualdad.",public_safety
Pwede ba mag-reklamo? snatching incident sa kanto kasi sa Peñafrancia. Thanks.,public_safety
Pwede ba mag-reklamo? dirty water supply form faucet kasi sa Concepcion Grande. Thanks.,utilities
Magtatanong lang po regarding cash for work payout delay sa Jesse Robredo Coliseum?,employment
concern lng re: colorum vehicles operating s naga city people's mall.,traffic
"Ask ko lang po kung may action na, nawalan ng internet connection kasi dito sa Panganiban Drive.",utilities
Please be informed that dirty water supply form faucet in the vicinity of Balatas.,utilities
Please be informed that stray dogs chasing people in the vicinity of Magsaysay Avenue.,health
Magtatanong lang po regarding estero needs cleaning sa Concepcion Pequeña?,sanitation
"Sir/Ma'am, pa-check naman po ng Mabolo, mabaho ang poultry sa residential area po kasi.",sanitation
"Concerned lang po kami sa mga bata, road obstruction by vendors dito sa UNC gate.",traffic
Concern lng re: looking for summer job for students s Carolina.,employment
Update po s sparking wires s poste s San Francisco? Wala pa action.,utilities
"JUSKO, NAWALAN NG INTERNET CONNECTION NANAMAN SA CAROLINA. ILANG ARAW NA TO.",utilities
"Huy pansinin niyo naman to. sira ang tulay, delikado sa Calauag. Nakaka-stress!",infrastructure
Reporting a concern regarding tricycle overcharging fare at Plaza Rizal.,traffic
I would like to report that sumabog ang transformer in LCC Mall.,utilities
Kailan po kaya maayos ang Ecology Park? tumataas ang cases ng dengue po kasi.,health
"Jusko, illegal jumper connection report nanaman sa Plaza Rizal. Ilang araw na to.",utilities
Anyone from city hall? slippery pathway due to moss here in Balatas. So hassle.,infrastructure
Please be informed that di hinahakot ang nabubulok in the vicinity of Mabolo.,waste_management
pwede ba mag-reklamo? looking for summer job for students kasi sa bicol central station. thanks.,employment
Kailan po kaya maayos ang LCC Mall? walang segregation policy po kasi.,waste_management
"Jusko, sira ang bubong ng waiting shed nanaman sa Pacol. Ilang araw na to.",infrastructure
Please be informed that water pipe leak sa kalsada in the vicinity of Del Rosario.,utilities
Please be informed that ubos na ang gamot sa center in the vicinity of Tinago.,health
Urgent: brownout nanaman d2 d2 s Ateneo Avenue.,utilities
Help. flu outbreak s area namin s Concepcion Pequeña. Pls fix.,health
Reporting a concern regarding ang lalim ng lubak sa daan at Balatas.,infrastructure
Help. may patay na daga s daan s Naga City People's Mall. Pls fix.,sanitation
Magtatanong lang po regarding traffic enforcer nangongotong sa Magsaysay Avenue?,traffic
I would like to report that inquiry for DOLE TUPAD program in Abella.,employment
Urgent: walng segregation policy d2 s Plaza Rizal.,waste_management
Urgent: burial assistance request d2 s Centro.,social_services
Gud pm. nagsusunog ng plastic ng kapitbahay s Sabng. Tnx.,waste_management
ANYONE FROM CITY HALL? MARAMING BATA ANG NILALAGNAT HERE IN TINAGO. SO HASSLE.,health
UPDATE PO S REQUESTING AMBULANCE ASSISTANCE S IGUALDAD? WALA PA ACTION.,health
FYI FADED PEDESTRIAN LANE MARKINGS S PLAZA RIZAL.,traffic
"Sir/Ma'am, pa-check naman po ng Bicol Central Station, 4ps beneficiary inquiry po kasi.",social_services
Huy pansinin niyo naman to. bitak-bitak na ang pader sa UNC gate. Nakaka-stress!,infrastructure
Formal complaint: clogged drainage causing smell located in Plaza Quince.,sanitation
Pwede ba mag-reklamo? road widening project delay kasi sa Naga City People's Mall. Thanks.,infrastructure
I would like to report that falling debris from construction in Liboton.,infrastructure
FYI KAILAN NG SCHEDULE NG HAKOT S SM NAGA AREA.,waste_management
"Sir/Ma'am, pa-check naman po ng Concepcion Grande, nakatagilid na ang poste po kasi.",infrastructure
Fyi may putol na kable s daan s Liboton.,utilities
"Kami po ay taga Carolina, report ko lang na feeding program request for kids.",social_services
Gud pm. sobrng baho ng kanal s Bicol Central Station. Tnx.,sanitation
"Kami po ay taga Mabolo, report ko lang na truck ban inquiry time.",traffic
"Sir/Ma'am, pa-check naman po ng Cararayan, walang sidewalk na madaanan po kasi.",infrastructure
Gud pm. dumi ng aso s sidewalk s San Felipe. Tnx.,sanitation
Help. gng war threat s Magsysy Avenue. Pls fix.,public_safety
"Grabe naman, meter reading error complaint dito sa Cararayan! Ano na??",utilities
"sir/ma'am, pa-check naman po ng ateneo avenue, traffic rerouting confusion po kasi.",traffic
"Jusko, walang tubig simula kanina nanaman sa UNC gate. Ilang araw na to.",utilities
Fyi no entry violation reports s Abella.,traffic
Formal complaint: stray dogs chasing people located in LCC Mall.,health
"Grabe naman, basurahan sa plaza puno na dito sa Plaza Quince! Ano na??",waste_management
"Kami po ay taga Tabuco, report ko lang na tesda training schedule inquiry.",employment
Huy pansinin niyo naman to. tanod sleeping on duty sa Santa Cruz. Nakaka-stress!,public_safety
"Sir/Ma'am, pa-check naman po ng UNC gate, pagtapon ng basura sa ilog po kasi.",waste_management
"sir/ma'am, pa-check naman po ng naga city people's mall, pest control request for barangay hall po kasi.",sanitation
Help. diarrhea outbreak due to dirty water s Ateneo Avenue. Pls fix.,health
reporting a concern regarding kalat ang basura sa park at carolina.,waste_management
"Jusko, tambak na basura sa kalsada nanaman sa Del Rosario. Ilang araw na to.",sanitation
TO THE CITY GOVERNMENT: WALANG SEGREGATION POLICY HERE IN PLAZA QUINCE. PLEASE INVESTIGATE.,waste_management
Parang wala namang action. may magnanakaw na umaaligid pa rin sa UNC gate.,public_safety
Update po s falling debris from construction s Abella? Wala pa action.,infrastructure
Magtatanong lang po regarding mabaho ang poultry sa residential area sa Metropolitan Cathedral?,sanitation
Pwede ba mag-reklamo? stray dogs chasing people kasi sa Magsaysay Avenue. Thanks.,health
Gud pm. loading/unloading violation s Tinago. Tnx.,traffic
Please be informed that contractualization issue in the vicinity of Dayangdang.,employment
"Kami po ay taga Magsaysay Avenue, report ko lang na drag racing ng motor sa gabi.",public_safety
Pwede ba mag-reklamo? may magnanakaw na umaaligid kasi sa Carolina. Thanks.,public_safety
Report ko lng inom s kalsda hnggng madaling araw d2 s Tringulo.,public_safety
Magtatanong lang po regarding need oxygen tank assistance sa San Felipe?,health
Pwede ba mag-reklamo? public toilet walang tubig at madumi kasi sa Plaza Rizal. Thanks.,sanitation
anyone from city hall? walang tubig simula kanina here in dinaga. so hassle.,utilities
"Kami po ay taga Centro, report ko lang na bitak-bitak na ang pader.",infrastructure
"Concerned lang po kami sa mga bata, gang war threat dito sa SM Naga area.",public_safety
To the City Government: puno na ang septic tank here in Tabuco. Please investigate.,sanitation
Gud pm. kailan ng schedule ng hakot s Concepcion Grande. Tnx.,waste_management
"Shoutout sa LGU, sobrang ingay ng videoke sa Igualdad. Please actionan agad.",public_safety
Parang wala namang action. paano kumuha ng pwd id pa rin sa Panganiban Drive.,social_services
Gud pm. unpaid overtime pay s Mabolo. Tnx.,employment
I would like to report that need oxygen tank assistance in Pacol.,health
"Grabe naman, penalty for littering inquiry dito sa San Felipe! Ano na??",waste_management
Anyone from city hall? defective solar lights here in Lerma. So hassle.,infrastructure
Urgent: medical assistance for indigent d2 s Pacol.,social_services
Kailan po kaya maayos ang Triangulo? snatching incident sa kanto po kasi.,public_safety
Reporting a concern regarding estero needs cleaning at Igualdad.,sanitation
Good day. We are requesting assistance because no entry violation reports at Abella.,traffic
Update po s mabaho ng poultry s residential area s Pnganiban Drive? Wala pa action.,sanitation
ANYONE FROM CITY HALL? MABAHO ANG POULTRY SA RESIDENTIAL AREA HERE IN NAGA CITY PEOPLE'S MALL. SO HASSLE.,sanitation
Anyone from city hall? discrimination sa hiring process here in Peñafrancia. So hassle.,employment
I would like to report that need oxygen tank assistance in Tabuco.,health
Parang wala namang action. road obstruction by vendors pa rin sa Abella.,traffic
"Shoutout sa LGU, defective solar lights sa Calauag. Please actionan agad.",infrastructure
"Grabe naman, ubos na ang gamot sa center dito sa Calauag! Ano na??",health
"Jusko, drainage cover is missing nanaman sa Metropolitan Cathedral. Ilang araw na to.",infrastructure
"Shoutout sa LGU, sobrang baho ng kanal sa LCC Mall. Please actionan agad.",sanitation
"Concerned lang po kami sa mga bata, estero needs cleaning dito sa San Felipe.",sanitation
"ask ko lang po kung may action na, masungit ang nurse sa clinic kasi dito sa san francisco.",health
I would like to report that medical certificate request for indigent in Jesse Robredo Coliseum.,health
Please be informed that sobrang ingay ng videoke in the vicinity of Santa Cruz.,public_safety
I WOULD LIKE TO REPORT THAT NO ENTRY VIOLATION REPORTS IN CENTRO.,traffic
Pwede ba mag-reklamo? nakatagilid na ang poste kasi sa Bagumbayan. Thanks.,infrastructure
Formal complaint: walang doctor sa health center located in Bagumbayan.,health
parang wala namang action. nagsusunog ng plastic ang kapitbahay pa rin sa liboton.,waste_management
Report ko lng basura nakatambak s harap ng school d2 s Plaza Rizal.,sanitation
Magtatanong lang po regarding calamity loan inquiry sa Centro?,social_services
Gud pm. nakatagilid na ng poste s Balatas. Tnx.,infrastructure
Kailan po kaya maayos ang Diversion Road? slippery pathway due to moss po kasi.,infrastructure
"SIR/MA'AM, PA-CHECK NAMAN PO NG SAN ISIDRO, PUNO NA ANG SEPTIC TANK PO KASI.",sanitation
Update po s requesting police visibility s San Isidro? Wala pa action.,public_safety
good day. we are requesting assistance because lost id replacement process at peñafrancia.,social_services
Kailan po kaya maayos ang Magsaysay Avenue? unpaid overtime pay po kasi.,employment
Concern lng re: recycling inquiry s Tabuco.,waste_management
"Sir/Ma'am, pa-check naman po ng San Francisco, walang doctor sa health center po kasi.",health
