text,category
Urgent: traffic enforcer nngongotong d2 s SM Naga area.,traffic
Kailan po kaya maayos ang Carolina? road widening project delay po kasi.,infrastructure
fyi public toilet walng tubig at madumi s balatas.,sanitation
"Kami po ay taga Concepcion Grande, report ko lang na clogged drainage causing smell.",sanitation
Urgent: estero needs cleaning d2 s Tinago.,sanitation
"Kami po ay taga Liboton, report ko lang na basketball court needs renovation.",infrastructure
Please be informed that medical assistance for indigent in the vicinity of San Francisco.,social_services
Kailan po kaya maayos ang Abella? dumi ng aso sa sidewalk po kasi.,sanitation
Gud pm. basurahan s plaza puno na s Jesse Robredo Coliseum. Tnx.,waste_management
Concern lng re: discrimination s hiring process s Bicol Central Station.,employment
Pwede ba mag-reklamo? grabe ang traffic ngayon kasi sa SM Naga area. Thanks.,traffic
I would like to report that sobrang baho ng kanal in Bagumbayan.,sanitation
GOOD DAY. WE ARE REQUESTING ASSISTANCE BECAUSE KULANG ANG BINIGAY NA RELIEF GOODS AT PANGANIBAN DRIVE.,social_services
"Sir/Ma'am, pa-check naman po ng Diversion Road, lost id replacement process po kasi.",social_services
Parang wala namang action. road rage incident report pa rin sa Bagumbayan.,traffic
"Ask ko lang po kung may action na, truck ban inquiry time kasi dito sa Cararayan.",traffic
Good day. We are requesting assistance because traffic enforcer nangongotong at Dayangdang.,traffic
"Concerned lang po kami sa mga bata, contractualization issue dito sa Triangulo.",employment
"Jusko, akyat bahay incident report nanaman sa San Isidro. Ilang araw na to.",public_safety
"Concerned lang po kami sa mga bata, child abuse report dito sa Jesse Robredo Coliseum.",social_services
Kailan po kaya maayos ang Mabolo? solo parent benefits inquiry po kasi.,social_services
Urgent: inom s kalsda hnggng madaling araw d2 s Tinago.,public_safety
Urgent: wala pa kaming natatnggap na ayuda d2 s Del Rosrio.,social_services
Good day. We are requesting assistance because maraming bata ang nilalagnat at Tinago.,health
Formal complaint: barangay hall renovation request located in Calauag.,infrastructure
To the City Government: nagsusunog ng plastic ang kapitbahay here in Plaza Rizal. Please investigate.,waste_management
Urgent: brownout nanaman d2 d2 s Sabng.,utilities
"ask ko lang po kung may action na, no entry violation reports kasi dito sa pacol.",traffic
"Kami po ay taga Concepcion Pequeña, report ko lang na unfair labor practice sa trabaho.",employment
I would like to report that pagtapon ng basura sa ilog in Liboton.,waste_management
Help. tanod sleeping on duty s Dinaga. Pls fix.,public_safety
"Concerned lang po kami sa mga bata, drainage cover is missing dito sa Pacol.",infrastructure
"Grabe naman, kailan ang schedule ng hakot dito sa SM Naga area! Ano na??",waste_management
"Jusko, water pipe leak sa kalsada nanaman sa Plaza Quince. Ilang araw na to.",utilities
Huy pansinin niyo naman to. dumi ng aso sa sidewalk sa SM Naga area. Nakaka-stress!,sanitation
"Sir/Ma'am, pa-check naman po ng Centro, drag racing ng motor sa gabi po kasi.",public_safety
"kami po ay taga plaza rizal, report ko lang na low water pressure tuwing umaga.",utilities
Report ko lng sobrng hina ng signal d2 s Pacol.,utilities
"Kami po ay taga LCC Mall, report ko lang na slippery pathway due to moss.",infrastructure
Fyi traffic enforcer nngongotong s Metropolitan Cathedral.,traffic
Pwede ba mag-reklamo? counter-flow na tricycle kasi sa Plaza Quince. Thanks.,traffic
Report ko lng nagkalat na used face masks d2 s Concepcion Grande.,sanitation
"kami po ay taga sabang, report ko lang na vawc desk assistance needed.",social_services
"Kami po ay taga Dinaga, report ko lang na walang segregation policy.",waste_management
CONCERN LNG RE: FINANCIAL AID FOR POOR STUDENTS S BAGUMBAYAN.,social_services
"Ask ko lang po kung may action na, ang lalim ng lubak sa daan kasi dito sa Cararayan.",infrastructure
Fyi looking for summer job for students s Peñafrancia.,employment
Please be informed that requesting ambulance assistance in the vicinity of Concepcion Grande.,health
Kailan po kaya maayos ang Balatas? walang segregation policy po kasi.,waste_management
Urgent: requesting police visibility d2 s Mabolo.,public_safety
Reporting a concern regarding unfinished road works causing traffic at Bicol Central Station.,infrastructure
"Sir/Ma'am, pa-check naman po ng LCC Mall, requesting ambulance assistance po kasi.",health
Pwede ba mag-reklamo? employer not paying SSS contribution kasi sa Dayangdang. Thanks.,employment
Good day. We are requesting assistance because walang sidewalk na madaanan at Cararayan.,infrastructure
"Ask ko lang po kung may action na, fluctuating ang kuryente kasi dito sa San Francisco.",utilities
Please be informed that malnourished children feeding program in the vicinity of Panicuason.,health
Help. road obstruction by vendors s Balatas. Pls fix.,traffic
Please be informed that may nag-aaway na lasing in the vicinity of Concepcion Grande.,public_safety
Anyone from city hall? cash for work payout delay here in Concepcion Pequeña. So hassle.,employment
Report ko lng child abuse report d2 s Ateneo Avenue.,social_services
"Kami po ay taga Triangulo, report ko lang na recycling inquiry.",waste_management
Urgent: illegal parking s kalsda d2 s Peñafrancia.,traffic
"Concerned lang po kami sa mga bata, nawalan ng internet connection dito sa Ateneo Avenue.",utilities
Fyi truck ban inquiry time s Liboton.,traffic
Magtatanong lang po regarding nagkalat na used face masks sa Mabolo?,sanitation
To the City Government: vandalism sa pader ng school here in Sabang. Please investigate.,public_safety
Concern lng re: sira ng bubong ng waiting shed s San Isidro.,infrastructure
Reporting a concern regarding nagkalat na used face masks at San Isidro.,sanitation
Reporting a concern regarding basurahan sa plaza puno na at Calauag.,waste_management
"Kami po ay taga Sabang, report ko lang na estero needs cleaning.",sanitation
Fyi requesting ambulance assistance s Peñafrancia.,health
"Grabe naman, snatching incident sa kanto dito sa Diversion Road! Ano na??",public_safety
Parang wala namang action. need oxygen tank assistance pa rin sa Bicol Central Station.,health
Parang wala namang action. akyat bahay incident report pa rin sa Panganiban Drive.,public_safety
"Kami po ay taga Diversion Road, report ko lang na road obstruction by vendors.",traffic
"Kami po ay taga Ateneo Avenue, report ko lang na tuberculosis medication out of stock.",health
Good day. We are requesting assistance because traffic rerouting confusion at Sabang.,traffic
"Shoutout sa LGU, collapsed riprap sa ilog sa Santa Cruz. Please actionan agad.",infrastructure
Gud pm. stray dogs chasing people s Ateneo Avenue. Tnx.,health
"Kami po ay taga Panganiban Drive, report ko lang na suspicious drug related activity.",public_safety
Good day. We are requesting assistance because walang tubig simula kanina at Abella.,utilities
Pwede ba mag-reklamo? solo parent benefits inquiry kasi sa Centro. Thanks.,social_services
Urgent: pest control request for barngay hall d2 s Diversion Road.,sanitation
To the City Government: paano kumuha ng pwd id here in Panganiban Drive. Please investigate.,social_services
Huy pansinin niyo naman to. marumi ang tubig na lumalabas sa gripo sa Dinaga. Nakaka-stress!,sanitation
"Ask ko lang po kung may action na, meter reading error complaint kasi dito sa Magsaysay Avenue.",utilities
"Ask ko lang po kung may action na, requesting ambulance assistance kasi dito sa SM Naga area.",health
To the City Government: stray dogs chasing people here in Igualdad. Please investigate.,health
Reporting a concern regarding bitak-bitak na ang pader at Pacol.,infrastructure
Pwede ba mag-reklamo? medical certificate request for indigent kasi sa Plaza Rizal. Thanks.,health
"KAMI PO AY TAGA PANGANIBAN DRIVE, REPORT KO LANG NA STRAY DOGS CHASING PEOPLE.",health
Fyi flu outbreak s area namin s Panicuason.,health
"Ask ko lang po kung may action na, ubos na ang gamot sa center kasi dito sa Naga City People's Mall.",health
Concern lng re: requesting ambulance assistance s Concepcion Pequeña.,health
"Grabe naman, public toilet walang tubig at madumi dito sa Panicuason! Ano na??",sanitation
Fyi colorum vehicles operating s Pnganiban Drive.,traffic
"Kami po ay taga Triangulo, report ko lang na low water pressure tuwing umaga.",utilities
Kailan po kaya maayos ang Dayangdang? road widening project delay po kasi.,infrastructure
Gud pm. calamity loan inquiry s Ecology Park. Tnx.,social_services
Pwede ba mag-reklamo? calamity loan inquiry kasi sa Plaza Quince. Thanks.,social_services
Fyi traffic enforcer nngongotong s Jesse Robredo Coliseum.,traffic
Report ko lng hindi dumaan ng garbage truck d2 s Panicuason.,waste_management
Pwede ba mag-reklamo? nagkalat na used face masks kasi sa San Isidro. Thanks.,sanitation
Gud pm. unpaid overtime pay s Concepcion Pequeña. Tnx.,employment
"Ask ko lang po kung may action na, nakatagilid na ang poste kasi dito sa Dayangdang.",infrastructure
Parang wala namang action. walang benefits na binibigay pa rin sa San Felipe.,employment
"Concerned lang po kami sa mga bata, cctv camera not working dito sa Centro.",infrastructure
Urgent: sobrng dilim ng eskinita d2 s LCC Mall.,public_safety
Huy pansinin niyo naman to. cash for work payout delay sa Magsaysay Avenue. Nakaka-stress!,employment
"Grabe naman, hindi dumaan ang garbage truck dito sa Abella! Ano na??",waste_management
Report ko lng drag racing ng motor s gabi d2 s Ecology Park.,public_safety
To the City Government: pagtapon ng basura sa ilog here in Concepcion Pequeña. Please investigate.,waste_management
Parang wala namang action. vandalism sa pader ng school pa rin sa Plaza Rizal.,public_safety
Update po s dead spot area for globe/smart s Liboton? Wala pa action.,utilities
Parang wala namang action. burial assistance request pa rin sa Liboton.,social_services
"Jusko, may patay na daga sa daan nanaman sa Peñafrancia. Ilang araw na to.",sanitation
To the City Government: penalty for littering inquiry here in Dayangdang. Please investigate.,waste_management
"Sir/Ma'am, pa-check naman po ng Del Rosario, basurahan sa plaza puno na po kasi.",waste_management
Kailan po kaya maayos ang Mabolo? curfew violation ng mga minor po kasi.,public_safety
Report ko lng unannounced water interruption d2 s Liboton.,utilities
"Jusko, mabaho ang poultry sa residential area nanaman sa Tinago. Ilang araw na to.",sanitation
Good day. We are requesting assistance because road widening project delay at San Isidro.,infrastructure
Fyi financial aid for poor students s Pacol.,social_services
To the City Government: inom sa kalsada hanggang madaling araw here in Diversion Road. Please investigate.,public_safety
To the City Government: pest control request for barangay hall here in Liboton. Please investigate.,sanitation
"Ask ko lang po kung may action na, hiring ba ng security guard kasi dito sa Peñafrancia.",employment
Fyi low water pressure tuwing umaga s Calauag.,utilities
To the City Government: status of scholarship application here in Naga City People's Mall. Please investigate.,social_services
Help. cctv camera not working s Centro. Pls fix.,infrastructure
"Grabe naman, traffic rerouting confusion dito sa Triangulo! Ano na??",traffic
"Jusko, kailan ang schedule ng hakot nanaman sa San Felipe. Ilang araw na to.",waste_management
Report ko lng feeding program request for kids d2 s Diversion Road.,social_services
"Jusko, discrimination sa hiring process nanaman sa San Isidro. Ilang araw na to.",employment
Urgent: pagtapon ng basura s ilog d2 s Plaza Rizal.,waste_management
good day. we are requesting assistance because unfinished road works causing traffic at tinago.,infrastructure
"Kami po ay taga Igualdad, report ko lang na unpaid overtime pay.",employment
Report ko lng walng doctor s health center d2 s Tinago.,health
HELP. HINDI DUMAAN NG GARBAGE TRUCK S PNGANIBAN DRIVE. PLS FIX.,waste_management
Huy pansinin niyo naman to. hiring ba ng security guard sa Balatas. Nakaka-stress!,employment
Please be informed that unannounced water interruption in the vicinity of Dayangdang.,utilities
"SHOUTOUT SA LGU, NAGSUSUNOG NG PLASTIC ANG KAPITBAHAY SA CAROLINA. PLEASE ACTIONAN AGAD.",waste_management
"jusko, kalat ang basura sa park nanaman sa cararayan. ilang araw na to.",waste_management
Kailan po kaya maayos ang Ateneo Avenue? low water pressure tuwing umaga po kasi.,utilities
Pwede ba mag-reklamo? drainage cover is missing kasi sa Dinaga. Thanks.,infrastructure
Kailan po kaya maayos ang Pacol? paano kumuha ng pwd id po kasi.,social_services
Good day. We are requesting assistance because bulky waste pickup request at Calauag.,waste_management
Reporting a concern regarding solo parent benefits inquiry at Ecology Park.,social_services
gud pm. water pipe leak s kalsda s magsysy avenue. tnx.,utilities
"Kami po ay taga San Francisco, report ko lang na ang lalim ng lubak sa daan.",infrastructure
Report ko lng inquiry for DOLE TUPAD program d2 s Tabuco.,employment
To the City Government: livelihood program for mothers here in Sabang. Please investigate.,employment
KAILAN PO KAYA MAAYOS ANG TINAGO? ILLEGAL JUMPER CONNECTION REPORT PO KASI.,utilities
"Kailan po kaya maayos ang Dayangdang? busted ang street lights, madilim po kasi.",infrastructure
I would like to report that nagsusunog ng plastic ang kapitbahay in Concepcion Pequeña.,waste_management
Concern lng re: snatching incident s kanto s Plaza Quince.,public_safety
Magtatanong lang po regarding no entry violation reports sa San Francisco?,traffic
"Ask ko lang po kung may action na, meter reading error complaint kasi dito sa Panicuason.",utilities
"Sir/Ma'am, pa-check naman po ng Tabuco, tricycle overcharging fare po kasi.",traffic
Pwede ba mag-reklamo? may nag-aaway na lasing kasi sa Panganiban Drive. Thanks.,public_safety
FYI NAGHAHANAP NG TRABAHO S PANICUASON.,employment
"Sir/Ma'am, pa-check naman po ng Centro, stray dogs chasing people po kasi.",health
Formal complaint: schedule ng tuli operation located in Bicol Central Station.,health
Reporting a concern regarding inquiry for DOLE TUPAD program at Plaza Rizal.,employment
Good day. We are requesting assistance because colorum vehicles operating at San Isidro.,traffic
ANYONE FROM CITY HALL? TESDA TRAINING SCHEDULE INQUIRY HERE IN SM NAGA AREA. SO HASSLE.,employment
"Sir/Ma'am, pa-check naman po ng Abella, need oxygen tank assistance po kasi.",health
"Sir/Ma'am, pa-check naman po ng Lerma, inom sa kalsada hanggang madaling araw po kasi.",public_safety
Magtatanong lang po regarding pest control request for barangay hall sa Ateneo Avenue?,sanitation
Report ko lng contractualization issue d2 s Carolina.,employment
"Grabe naman, street light flickering on and off dito sa Diversion Road! Ano na??",utilities
Help. double parking s main road s Panicuason. Pls fix.,traffic
"Sir/Ma'am, pa-check naman po ng Centro, kailan ang schedule ng hakot po kasi.",waste_management
"ASK KO LANG PO KUNG MAY ACTION NA, REQUESTING POLICE VISIBILITY KASI DITO SA CALAUAG.",public_safety
I would like to report that tumataas ang cases ng dengue in Concepcion Grande.,health
Formal complaint: sumabog ang transformer located in Cararayan.,utilities
Parang wala namang action. penalty for littering inquiry pa rin sa Cararayan.,waste_management
Report ko lng dumi ng aso s sidewalk d2 s Metropolitan Cathedral.,sanitation
"SHOUTOUT SA LGU, PENALTY FOR LITTERING INQUIRY SA TRIANGULO. PLEASE ACTIONAN AGAD.",waste_management
"Ask ko lang po kung may action na, suspicious person taking photos kasi dito sa Ateneo Avenue.",public_safety
Good day. We are requesting assistance because grabe ang traffic ngayon at Plaza Quince.,traffic
Fyi low water pressure tuwing umaga s Naga City People's Mall.,utilities
help. unfinished road works causing traffic s diversion road. pls fix.,infrastructure
TO THE CITY GOVERNMENT: FEEDING PROGRAM REQUEST FOR KIDS HERE IN LIBOTON. PLEASE INVESTIGATE.,social_services
Good day. We are requesting assistance because ang lalim ng lubak sa daan at Naga City People's Mall.,infrastructure
"Concerned lang po kami sa mga bata, openings for construction workers dito sa Peñafrancia.",employment
Report ko lng walng available na covid vaccine d2 s Igualdad.,health
To the City Government: tesda training schedule inquiry here in Abella. Please investigate.,employment
"Concerned lang po kami sa mga bata, vandalism sa pader ng school dito sa Lerma.",public_safety
"KAMI PO AY TAGA SAN FRANCISCO, REPORT KO LANG NA BASKETBALL COURT NEEDS RENOVATION.",infrastructure
kailan po kaya maayos ang balatas? hindi dumaan ang garbage truck po kasi.,waste_management
Gud pm. may putol na kable s daan s San Francisco. Tnx.,utilities
Fyi unannounced water interruption s Balatas.,utilities
Fyi pagtapon ng basura s ilog s San Felipe.,waste_management
Kailan po kaya maayos ang Magsaysay Avenue? marumi ang tubig na lumalabas sa gripo po kasi.,sanitation
Urgent: shocking electricity bill amount d2 s San Francisco.,utilities
To the City Government: unannounced water interruption here in Liboton. Please investigate.,utilities
Report ko lng kailan ng next job fair d2 s Diversion Road.,employment
Fyi burial assistance request s Tinago.,social_services
"Jusko, contractualization issue nanaman sa Bagumbayan. Ilang araw na to.",employment
"Jusko, dead spot area for globe/smart nanaman sa Bicol Central Station. Ilang araw na to.",utilities
Pwede ba mag-reklamo? dead spot area for globe/smart kasi sa Tabuco. Thanks.,utilities
"SHOUTOUT SA LGU, ILLEGAL PARKING SA KALSADA SA CENTRO. PLEASE ACTIONAN AGAD.",traffic
To the City Government: road widening project delay here in Plaza Quince. Please investigate.,infrastructure
Urgent: walng garbage collector personnel d2 s Del Rosrio.,waste_management
Pwede ba mag-reklamo? may patay na daga sa daan kasi sa Calauag. Thanks.,sanitation
Pwede ba mag-reklamo? tesda training schedule inquiry kasi sa Triangulo. Thanks.,employment
Pwede ba mag-reklamo? colorum vehicles operating kasi sa Concepcion Grande. Thanks.,traffic
pwede ba mag-reklamo? illegal parking sa kalsada kasi sa ateneo avenue. thanks.,traffic
Formal complaint: need namin ng schedule for anti-rabies located in Magsaysay Avenue.,health
Urgent: stray dogs chasing people d2 s Abella.,health
Anyone from city hall? senior citizen pension delay here in Pacol. So hassle.,social_services
Pwede ba mag-reklamo? unfinished road works causing traffic kasi sa Triangulo. Thanks.,infrastructure
Concern lng re: walng sidewalk na madaanan s Metropolitan Cathedral.,infrastructure
Gud pm. child abuse report s Pacol. Tnx.,social_services
Kailan po kaya maayos ang Magsaysay Avenue? solo parent benefits inquiry po kasi.,social_services
"Grabe naman, suspicious person taking photos dito sa Cararayan! Ano na??",public_safety
Help. schedule ng tuli operation s Cararayan. Pls fix.,health
Parang wala namang action. walang segregation policy pa rin sa Pacol.,waste_management
Concern lng re: kailan ng schedule ng hakot s Cararayan.,waste_management
Parang wala namang action. paano kumuha ng pwd id pa rin sa Diversion Road.,social_services
Anyone from city hall? walang tubig simula kanina here in Plaza Rizal. So hassle.,utilities
"Grabe naman, schedule ng tuli operation dito sa Tinago! Ano na??",health
"Grabe naman, nagkalat na used face masks dito sa Jesse Robredo Coliseum! Ano na??",sanitation
"CONCERNED LANG PO KAMI SA MGA BATA, INQUIRY FOR DOLE TUPAD PROGRAM DITO SA CARARAYAN.",employment
Kailan po kaya maayos ang Plaza Rizal? colorum vehicles operating po kasi.,traffic
"Ask ko lang po kung may action na, stray dogs chasing people kasi dito sa Santa Cruz.",health
Pwede ba mag-reklamo? delayed ang sweldo ng workers kasi sa Bicol Central Station. Thanks.,employment
"Concerned lang po kami sa mga bata, drag racing ng motor sa gabi dito sa Peñafrancia.",public_safety
"Grabe naman, sparking wires sa poste dito sa Dayangdang! Ano na??",utilities
To the City Government: defective solar lights here in San Isidro. Please investigate.,infrastructure
Pwede ba mag-reklamo? need namin ng schedule for anti-rabies kasi sa Tinago. Thanks.,health
Report ko lng drag racing ng motor s gabi d2 s Tabuco.,public_safety
Update po s traffic enforcer nngongotong s Balatas? Wala pa action.,traffic
Help. colorum vehicles operating s Bagumbayan. Pls fix.,traffic
To the City Government: unpaid overtime pay here in Concepcion Pequeña. Please investigate.,employment
"Jusko, double parking sa main road nanaman sa Liboton. Ilang araw na to.",traffic
Update po s traffic rerouting confusion s Jesse Robredo Coliseum? Wala pa action.,traffic
Huy pansinin niyo naman to. walang tubig simula kanina sa Naga City People's Mall. Nakaka-stress!,utilities
Magtatanong lang po regarding sobrang baho ng kanal sa Ateneo Avenue?,sanitation
Parang wala namang action. stray dogs chasing people pa rin sa Panicuason.,health
"Grabe naman, need oxygen tank assistance dito sa Cararayan! Ano na??",health
Help. jeepney cutting trip violation s Metropolitan Cathedral. Pls fix.,traffic
Anyone from city hall? feeding program request for kids here in Naga City People's Mall. So hassle.,social_services
"Jusko, need namin ng schedule for anti-rabies nanaman sa Sabang. Ilang araw na to.",health
"Good day. We are requesting assistance because busted ang street lights, madilim at Bagumbayan.",infrastructure
"Kami po ay taga SM Naga area, report ko lang na estero needs cleaning.",sanitation
Report ko lng ng lalim ng lubak s daan d2 s Dinaga.,infrastructure
Kailan po kaya maayos ang Mabolo? sparking wires sa poste po kasi.,utilities
"Shoutout sa LGU, delayed ang sweldo ng workers sa Diversion Road. Please actionan agad.",employment
"Shoutout sa LGU, dead spot area for globe/smart sa Panicuason. Please actionan agad.",utilities
Formal complaint: basurahan sa plaza puno na located in Jesse Robredo Coliseum.,waste_management
Gud pm. burial assistance request s Pacol. Tnx.,social_services
"Concerned lang po kami sa mga bata, may putol na kable sa daan dito sa Bicol Central Station.",utilities
"Shoutout sa LGU, may patay na daga sa daan sa Peñafrancia. Please actionan agad.",sanitation
"Kami po ay taga Pacol, report ko lang na unsanitary street food vendors.",sanitation
Report ko lng unfair labor practice s trabaho d2 s Lerma.,employment
"Shoutout sa LGU, solo parent benefits inquiry sa Ecology Park. Please actionan agad.",social_services
Report ko lng traffic rerouting confusion d2 s Ecology Park.,traffic
"Shoutout sa LGU, diarrhea outbreak due to dirty water sa UNC gate. Please actionan agad.",health
"Kami po ay taga Pacol, report ko lang na livelihood program for mothers.",employment
Reporting a concern regarding financial aid for poor students at Metropolitan Cathedral.,social_services
Kailan po kaya maayos ang Naga City People's Mall? looking for summer job for students po kasi.,employment
"Jusko, riot ng mga kabataan kagabi nanaman sa Naga City People's Mall. Ilang araw na to.",public_safety
"Jusko, riot ng mga kabataan kagabi nanaman sa Calauag. Ilang araw na to.",public_safety
Please be informed that burial assistance request in the vicinity of San Isidro.,social_services
Reporting a concern regarding basura bumabara sa drainage at LCC Mall.,waste_management
Help. sparking wires s poste s Bagumbayan. Pls fix.,utilities
"Grabe naman, kulang ang binigay na relief goods dito sa Ateneo Avenue! Ano na??",social_services
Update po s grabe ng traffic ngayon s Pnganiban Drive? Wala pa action.,traffic
"Concerned lang po kami sa mga bata, 4ps beneficiary inquiry dito sa Carolina.",social_services
Report ko lng may patay na daga s daan d2 s Concepcion Grande.,sanitation
Help. tumataas ng cases ng dengue s Ateneo Avenue. Pls fix.,health
formal complaint: counter-flow na tricycle located in carolina.,traffic
"Sir/Ma'am, pa-check naman po ng Abella, suspicious person taking photos po kasi.",public_safety
Urgent: walng sidewalk na madaanan d2 s Santa Cruz.,infrastructure
Anyone from city hall? falling debris from construction here in San Isidro. So hassle.,infrastructure
"Jusko, sobrang hina ng signal nanaman sa Sabang. Ilang araw na to.",utilities
Anyone from city hall? walang garbage collector personnel here in Tabuco. So hassle.,waste_management
"Jusko, illegal jumper connection report nanaman sa Peñafrancia. Ilang araw na to.",utilities
GUD PM. UNSNITARY STREET FOOD VENDORS S CALAUAG. TNX.,sanitation
Urgent: no entry violation reports d2 s Carolina.,traffic
To the City Government: sumabog ang transformer here in Centro. Please investigate.,utilities
Pwede ba mag-reklamo? senior citizen pension delay kasi sa San Isidro. Thanks.,social_services
"Shoutout sa LGU, road obstruction by vendors sa Dinaga. Please actionan agad.",traffic
"Jusko, unsanitary street food vendors nanaman sa San Francisco. Ilang araw na to.",sanitation
I would like to report that counter-flow na tricycle in Igualdad.,traffic
Kailan po kaya maayos ang LCC Mall? jeepney cutting trip violation po kasi.,traffic
"Concerned lang po kami sa mga bata, sobrang hina ng signal dito sa Abella.",utilities
Kailan po kaya maayos ang San Isidro? double parking sa main road po kasi.,traffic
Kailan po kaya maayos ang Centro? walang tubig simula kanina po kasi.,utilities
Kailan po kaya maayos ang Bagumbayan? sobrang dilim ng eskinita po kasi.,public_safety
Reporting a concern regarding tricycle overcharging fare at San Isidro.,traffic
Gud pm. street light flickering on and off s Del Rosrio. Tnx.,utilities
To the City Government: unannounced water interruption here in San Felipe. Please investigate.,utilities
Report ko lng low water pressure tuwing umaga d2 s Tabuco.,utilities
Concern lng re: water pipe leak s kalsda s Ecology Park.,utilities
"Jusko, estero needs cleaning nanaman sa Carolina. Ilang araw na to.",sanitation
Urgent: tambak na basura s kalsda d2 s Tinago.,sanitation
