text,category
"Sir/Ma'am, pa-check naman po ng Liboton, unannounced water interruption po kasi.",utilities
Report ko lng solo parent benefits inquiry d2 s Ateneo Avenue.,social_services
Report ko lng di hinahakot ng nabubulok d2 s Pacol.,waste_management
Anyone from city hall? maraming bata ang nilalagnat here in Triangulo. So hassle.,health
HUY PANSININ NIYO NAMAN TO. REQUESTING POLICE VISIBILITY SA TRIANGULO. NAKAKA-STRESS!,public_safety
help. sira ng bubong ng waiting shed s pacol. pls fix.,infrastructure
"SIR/MA'AM, PA-CHECK NAMAN PO NG PACOL, PUBLIC TOILET WALANG TUBIG AT MADUMI PO KASI.",sanitation
please be informed that 4ps beneficiary inquiry in the vicinity of centro.,social_services
"Ask ko lang po kung may action na, bitak-bitak na ang pader kasi dito sa Centro.",infrastructure
"Ask ko lang po kung may action na, estero needs cleaning kasi dito sa Pacol.",sanitation
Kailan po kaya maayos ang Triangulo? double parking sa main road po kasi.,traffic
Pwede ba mag-reklamo? cctv camera not working kasi sa Plaza Quince. Thanks.,infrastructure
URGENT: BROWNOUT NANAMAN D2 D2 S CARARAYAN.,utilities
Good day. We are requesting assistance because contractualization issue at San Isidro.,employment
Concern lng re: senior citizen pension delay s Metropolitan Cathedral.,social_services
Formal complaint: tumataas ang cases ng dengue located in Plaza Quince.,health
Pwede ba mag-reklamo? public toilet walang tubig at madumi kasi sa Panicuason. Thanks.,sanitation
Fyi delayed ng sweldo ng workers s San Isidro.,employment
"Shoutout sa LGU, livelihood program for mothers sa Ateneo Avenue. Please actionan agad.",employment
report ko lng slippery pathway due to moss d2 s tabuco.,infrastructure
Report ko lng nawalan ng internet connection d2 s Ecology Park.,utilities
Update po s unfinished road works causing traffic s Plaza Rizal? Wala pa action.,infrastructure
"Good day. We are requesting assistance because sira ang tulay, delikado at Sabang.",infrastructure
UPDATE PO S COUNTER-FLOW NA TRICYCLE S MAGSYSY AVENUE? WALA PA ACTION.,traffic
To the City Government: street light flickering on and off here in Cararayan. Please investigate.,utilities
"Grabe naman, nagkalat na used face masks dito sa Liboton! Ano na??",sanitation
I would like to report that counter-flow na tricycle in Tinago.,traffic
Anyone from city hall? paano kumuha ng pwd id here in Concepcion Grande. So hassle.,social_services
"Kailan po kaya maayos ang Abella? busted ang street lights, madilim po kasi.",infrastructure
Reporting a concern regarding akyat bahay incident report at Peñafrancia.,public_safety
"Shoutout sa LGU, colorum vehicles operating sa Calauag. Please actionan agad.",traffic
To the City Government: gang war threat here in Cararayan. Please investigate.,public_safety
"Shoutout sa LGU, nakatagilid na ang poste sa Plaza Quince. Please actionan agad.",infrastructure
gud pm. stray dogs chasing people s del rosrio. tnx.,health
Reporting a concern regarding basurahan sa plaza puno na at Triangulo.,waste_management
Pwede ba mag-reklamo? akyat bahay incident report kasi sa Mabolo. Thanks.,public_safety
"Kami po ay taga Ateneo Avenue, report ko lang na sira ang traffic light.",traffic
Update po s senior citizen pension delay s Metropolitan Cathedral? Wala pa action.,social_services
Reporting a concern regarding illegal dismissal complaint at LCC Mall.,employment
Huy pansinin niyo naman to. akyat bahay incident report sa Jesse Robredo Coliseum. Nakaka-stress!,public_safety
Good day. We are requesting assistance because road widening project delay at Sabang.,infrastructure
Report ko lng walng segregation policy d2 s Ateneo Avenue.,waste_management
Huy pansinin niyo naman to. may magnanakaw na umaaligid sa Concepcion Pequeña. Nakaka-stress!,public_safety
Huy pansinin niyo naman to. requesting ambulance assistance sa San Francisco. Nakaka-stress!,health
"Ask ko lang po kung may action na, malnourished children feeding program kasi dito sa Abella.",health
"Reporting a concern regarding daming lamok, need fumigation at Naga City People's Mall.",health
Reporting a concern regarding flu outbreak sa area namin at Diversion Road.,health
Concern lng re: sobrng hina ng signal s Panicuason.,utilities
concern lng re: gng war threat s concepcion pequeña.,public_safety
Kailan po kaya maayos ang Bagumbayan? drainage cover is missing po kasi.,infrastructure
"Shoutout sa LGU, sobrang hina ng signal sa Panicuason. Please actionan agad.",utilities
"Ask ko lang po kung may action na, may putol na kable sa daan kasi dito sa Magsaysay Avenue.",utilities
Report ko lng recycling inquiry d2 s Sabng.,waste_management
"Kami po ay taga Triangulo, report ko lang na shocking electricity bill amount.",utilities
Anyone from city hall? dirty water supply form faucet here in San Isidro. So hassle.,utilities
Good day. We are requesting assistance because faded pedestrian lane markings at Dinaga.,traffic
Reporting a concern regarding dirty water supply form faucet at Mabolo.,utilities
Concern lng re: akyat bahay incident report s San Felipe.,public_safety
Urgent: walng benefits na binibigay d2 s Plaza Rizal.,employment
"Shoutout sa LGU, walang doctor sa health center sa Dayangdang. Please actionan agad.",health
"Grabe naman, illegal dismissal complaint dito sa Abella! Ano na??",employment
"Sir/Ma'am, pa-check naman po ng Tabuco, slippery pathway due to moss po kasi.",infrastructure
Update po s walng segregation policy s LCC Mall? Wala pa action.,waste_management
Gud pm. inom s kalsda hnggng madaling araw s Peñafrancia. Tnx.,public_safety
anyone from city hall? child abuse report here in calauag. so hassle.,social_services
"Ask ko lang po kung may action na, daming lamok, need fumigation kasi dito sa Diversion Road.",health
Help. collapsed riprap s ilog s Dinaga. Pls fix.,infrastructure
Concern lng re: brownout nanaman d2 s Metropolitan Cathedral.,utilities
Update po s kulng ng binigay na relief goods s UNC gate? Wala pa action.,social_services
Concern lng re: slippery pathway due to moss s Ecology Park.,infrastructure
PLEASE BE INFORMED THAT UNSANITARY STREET FOOD VENDORS IN THE VICINITY OF METROPOLITAN CATHEDRAL.,sanitation
"Jusko, akyat bahay incident report nanaman sa Calauag. Ilang araw na to.",public_safety
"Grabe naman, vandalism sa pader ng school dito sa San Felipe! Ano na??",public_safety
Anyone from city hall? medical assistance for indigent here in San Isidro. So hassle.,social_services
"Shoutout sa LGU, walang doctor sa health center sa Panganiban Drive. Please actionan agad.",health
KAILAN PO KAYA MAAYOS ANG PACOL? BATO-BATO SA SASAKYAN INCIDENTS PO KASI.,public_safety
Anyone from city hall? slippery pathway due to moss here in Sabang. So hassle.,infrastructure
Magtatanong lang po regarding pest control request for barangay hall sa Magsaysay Avenue?,sanitation
"Grabe naman, mabaho ang poultry sa residential area dito sa Metropolitan Cathedral! Ano na??",sanitation
Please be informed that truck ban inquiry time in the vicinity of Centro.,traffic
Help. shocking electricity bill amount s Calauag. Pls fix.,utilities
"Sir/Ma'am, pa-check naman po ng Mabolo, clogged drainage causing smell po kasi.",sanitation
update po s gng war threat s calauag? wala pa action.,public_safety
Help. need namin ng schedule for anti-rabies s Mabolo. Pls fix.,health
Huy pansinin niyo naman to. curfew violation ng mga minor sa Cararayan. Nakaka-stress!,public_safety
Good day. We are requesting assistance because sobrang baho ng kanal at Dayangdang.,sanitation
"Ask ko lang po kung may action na, requesting police visibility kasi dito sa Plaza Quince.",public_safety
Urgent: walng available na covid vaccine d2 s Abella.,health
Huy pansinin niyo naman to. suspicious drug related activity sa Ecology Park. Nakaka-stress!,public_safety
Update po s bato-bato s sskyan incidents s Naga City People's Mall? Wala pa action.,public_safety
Anyone from city hall? defective solar lights here in Bicol Central Station. So hassle.,infrastructure
"Jusko, walang available na covid vaccine nanaman sa Panganiban Drive. Ilang araw na to.",health
I would like to report that illegal dumping site sa vacant lot in Metropolitan Cathedral.,waste_management
Anyone from city hall? sobrang baho ng kanal here in LCC Mall. So hassle.,sanitation
"Sir/Ma'am, pa-check naman po ng Plaza Rizal, busted ang street lights, madilim po kasi.",infrastructure
Magtatanong lang po regarding kailan ang schedule ng hakot sa Magsaysay Avenue?,waste_management
Help. kailan ng next job fair s Lerma. Pls fix.,employment
Concern lng re: employer not paying SSS contribution s Bagumbayan.,employment
Gud pm. penalty for littering inquiry s Ateneo Avenue. Tnx.,waste_management
Concern lng re: walng garbage collector personnel s Tabuco.,waste_management
Anyone from city hall? illegal dismissal complaint here in Pacol. So hassle.,employment
I would like to report that falling debris from construction in Bicol Central Station.,infrastructure
Anyone from city hall? employer not paying SSS contribution here in Plaza Quince. So hassle.,employment
Help. social pension payout schedule s Plaza Rizal. Pls fix.,social_services
"Sir/Ma'am, pa-check naman po ng Naga City People's Mall, snatching incident sa kanto po kasi.",public_safety
Reporting a concern regarding contractualization issue at Metropolitan Cathedral.,employment
"Sir/Ma'am, pa-check naman po ng Carolina, snatching incident sa kanto po kasi.",public_safety
Concern lng re: inquiry for DOLE TUPAD program s Ateneo Avenue.,employment
"Fyi daming lamok, need fumigation s Ateneo Avenue.",health
Huy pansinin niyo naman to. flu outbreak sa area namin sa Metropolitan Cathedral. Nakaka-stress!,health
"Ask ko lang po kung may action na, puno na ang septic tank kasi dito sa Naga City People's Mall.",sanitation
"Kami po ay taga Dinaga, report ko lang na diarrhea outbreak due to dirty water.",health
Good day. We are requesting assistance because kalat ang basura sa park at Plaza Rizal.,waste_management
"Grabe naman, tumataas ang cases ng dengue dito sa Calauag! Ano na??",health
Fyi double parking s main road s Abella.,traffic
"Ask ko lang po kung may action na, composting facility foul odor kasi dito sa Peñafrancia.",waste_management
"Concerned lang po kami sa mga bata, lost id replacement process dito sa Ateneo Avenue.",social_services
"Concerned lang po kami sa mga bata, illegal parking sa kalsada dito sa Calauag.",traffic
Update po s public toilet walng tubig at madumi s Peñafrancia? Wala pa action.,sanitation
"concerned lang po kami sa mga bata, low water pressure tuwing umaga dito sa lerma.",utilities
"Formal complaint: daming lamok, need fumigation located in Jesse Robredo Coliseum.",health
Update po s sobrng ingay ng videoke s Abella? Wala pa action.,public_safety
"Sir/Ma'am, pa-check naman po ng Cararayan, recycling inquiry po kasi.",waste_management
"Concerned lang po kami sa mga bata, requesting police visibility dito sa Concepcion Grande.",public_safety
Please be informed that malnourished children feeding program in the vicinity of Calauag.,health
Urgent: basura bumabara s drainage d2 s Magsysy Avenue.,waste_management
"Sir/Ma'am, pa-check naman po ng Lerma, illegal dumping site sa vacant lot po kasi.",waste_management
Help. employer not paying SSS contribution s Mabolo. Pls fix.,employment
Update po s sira ng traffic light s Concepcion Grande? Wala pa action.,traffic
Urgent: barngay hall renovation request d2 s Tringulo.,infrastructure
"Ask ko lang po kung may action na, kailan ang next job fair kasi dito sa Dinaga.",employment
Parang wala namang action. tanod sleeping on duty pa rin sa San Isidro.,public_safety
"Concerned lang po kami sa mga bata, suspicious person taking photos dito sa Balatas.",public_safety
Reporting a concern regarding child abuse report at Dinaga.,social_services
Fyi akyat bahay incident report s Carolina.,public_safety
Gud pm. composting facility foul odor s Plaza Rizal. Tnx.,waste_management
Fyi wala pa kaming natatnggap na ayuda s Liboton.,social_services
Magtatanong lang po regarding need namin ng schedule for anti-rabies sa Lerma?,health
To the City Government: brownout nanaman dito here in Carolina. Please investigate.,utilities
formal complaint: unannounced water interruption located in peñafrancia.,utilities
Parang wala namang action. calamity loan inquiry pa rin sa Concepcion Grande.,social_services
Reporting a concern regarding puno na ang septic tank at Panganiban Drive.,sanitation
Fyi drag racing ng motor s gabi s Pacol.,public_safety
magtatanong lang po regarding feeding program request for kids sa concepcion pequeña?,social_services
Urgent: illegal jumper connection report d2 s Mabolo.,utilities
Concern lng re: drag racing ng motor s gabi s Metropolitan Cathedral.,public_safety
Help. medical certificate request for indigent s Peñafrancia. Pls fix.,health
"Jusko, composting facility foul odor nanaman sa Lerma. Ilang araw na to.",waste_management
Fyi sumabog ng transformer s Tringulo.,utilities
I would like to report that truck ban inquiry time in Panicuason.,traffic
Please be informed that lost id replacement process in the vicinity of Plaza Quince.,social_services
Reporting a concern regarding bulky waste pickup request at Sabang.,waste_management
"Gud pm. sira ng tulay, delikado s Panicuason. Tnx.",infrastructure
"Ask ko lang po kung may action na, daming lamok, need fumigation kasi dito sa Abella.",health
I would like to report that openings for construction workers in Jesse Robredo Coliseum.,employment
Reporting a concern regarding discrimination sa hiring process at Lerma.,employment
Reporting a concern regarding illegal jumper connection report at Dinaga.,utilities
"Gud pm. busted ng street lights, madilim s Cararayan. Tnx.",infrastructure
"Ask ko lang po kung may action na, collapsed riprap sa ilog kasi dito sa Panganiban Drive.",infrastructure
"Ask ko lang po kung may action na, pagtapon ng basura sa ilog kasi dito sa San Francisco.",waste_management
UPDATE PO S SOBRNG INGAY NG VIDEOKE S CAROLINA? WALA PA ACTION.,public_safety
Reporting a concern regarding openings for construction workers at San Isidro.,employment
Kailan po kaya maayos ang Sabang? burial assistance request po kasi.,social_services
Please be informed that nagsusunog ng plastic ang kapitbahay in the vicinity of Ecology Park.,waste_management
Anyone from city hall? akyat bahay incident report here in SM Naga area. So hassle.,public_safety
Magtatanong lang po regarding naghahanap ng trabaho sa Dinaga?,employment
"Shoutout sa LGU, walang benefits na binibigay sa Concepcion Pequeña. Please actionan agad.",employment
"Ask ko lang po kung may action na, road widening project delay kasi dito sa Triangulo.",infrastructure
Concern lng re: medical assistance for indigent s Dayngdng.,social_services
Please be informed that truck ban inquiry time in the vicinity of Concepcion Grande.,traffic
"Concerned lang po kami sa mga bata, ang lalim ng lubak sa daan dito sa Triangulo.",infrastructure
Fyi kailan ng schedule ng hakot s Jesse Robredo Coliseum.,waste_management
"Ask ko lang po kung may action na, birthday cash gift for senior kasi dito sa Igualdad.",social_services
Report ko lng walng tubig simula kanina d2 s Tinago.,utilities
Formal complaint: walang tubig simula kanina located in Bagumbayan.,utilities
"Jusko, mabaho ang poultry sa residential area nanaman sa Tinago. Ilang araw na to.",sanitation
I would like to report that diarrhea outbreak due to dirty water in Pacol.,health
Gud pm. cctv camera not working s Calauag. Tnx.,infrastructure
parang wala namang action. mabaho ang poultry sa residential area pa rin sa balatas.,sanitation
"Jusko, gang war threat nanaman sa Ecology Park. Ilang araw na to.",public_safety
Update po s meter reading error complaint s Ateneo Avenue? Wala pa action.,utilities
"Sir/Ma'am, pa-check naman po ng Tinago, unfinished road works causing traffic po kasi.",infrastructure
Fyi jeepney cutting trip violation s Dayngdng.,traffic
update po s clogged drainage causing smell s del rosrio? wala pa action.,sanitation
kailan po kaya maayos ang balatas? need oxygen tank assistance po kasi.,health
Huy pansinin niyo naman to. congested intersection always sa UNC gate. Nakaka-stress!,traffic
Parang wala namang action. birthday cash gift for senior pa rin sa Igualdad.,social_services
TO THE CITY GOVERNMENT: SOBRANG DILIM NG ESKINITA HERE IN TABUCO. PLEASE INVESTIGATE.,public_safety
I would like to report that nakatagilid na ang poste in Bagumbayan.,infrastructure
"Shoutout sa LGU, walang benefits na binibigay sa Triangulo. Please actionan agad.",employment
"Grabe naman, illegal dismissal complaint dito sa Mabolo! Ano na??",employment
Magtatanong lang po regarding double parking sa main road sa Pacol?,traffic
"Kami po ay taga SM Naga area, report ko lang na walang sidewalk na madaanan.",infrastructure
kailan po kaya maayos ang bicol central station? public toilet walang tubig at madumi po kasi.,sanitation
"Grabe naman, bitak-bitak na ang pader dito sa Sabang! Ano na??",infrastructure
"Grabe naman, kulang ang binigay na relief goods dito sa Dinaga! Ano na??",social_services
To the City Government: walang tubig simula kanina here in Jesse Robredo Coliseum. Please investigate.,utilities
"Kami po ay taga Bicol Central Station, report ko lang na illegal dumping site sa vacant lot.",waste_management
I would like to report that barangay hall renovation request in Tinago.,infrastructure
I would like to report that requesting ambulance assistance in Carolina.,health
To the City Government: tumataas ang cases ng dengue here in Carolina. Please investigate.,health
"Good day. We are requesting assistance because sira ang tulay, delikado at San Felipe.",infrastructure
Update po s need oxygen tank assistance s San Francisco? Wala pa action.,health
To the City Government: cash for work payout delay here in Tabuco. Please investigate.,employment
"jusko, social pension payout schedule nanaman sa tinago. ilang araw na to.",social_services
please be informed that no entry violation reports in the vicinity of calauag.,traffic
Gud pm. solo parent benefits inquiry s Abella. Tnx.,social_services
Good day. We are requesting assistance because meter reading error complaint at Del Rosario.,utilities
Parang wala namang action. road rage incident report pa rin sa Peñafrancia.,traffic
Anyone from city hall? hiring ba ng security guard here in Bagumbayan. So hassle.,employment
Fyi senior citizen pension delay s Centro.,social_services
Please be informed that walang garbage collector personnel in the vicinity of Cararayan.,waste_management
Magtatanong lang po regarding traffic rerouting confusion sa Lerma?,traffic
"Shoutout sa LGU, daming lamok, need fumigation sa Santa Cruz. Please actionan agad.",health
I would like to report that sobrang ingay ng videoke in Liboton.,public_safety
"Anyone from city hall? daming lamok, need fumigation here in Dayangdang. So hassle.",health
"Good day. We are requesting assistance because sira ang tulay, delikado at UNC gate.",infrastructure
Magtatanong lang po regarding walang benefits na binibigay sa Pacol?,employment
To the City Government: delayed ang sweldo ng workers here in Diversion Road. Please investigate.,employment
Update po s recycling inquiry s Peñafrancia? Wala pa action.,waste_management
Report ko lng snatching incident s kanto d2 s Bagumbayan.,public_safety
"Ask ko lang po kung may action na, sira ang bubong ng waiting shed kasi dito sa Bagumbayan.",infrastructure
"Jusko, may patay na daga sa daan nanaman sa Liboton. Ilang araw na to.",sanitation
I would like to report that pest control request for barangay hall in Calauag.,sanitation
"Concerned lang po kami sa mga bata, bitak-bitak na ang pader dito sa Peñafrancia.",infrastructure
Gud pm. cash for work payout delay s Plaza Quince. Tnx.,employment
"Kami po ay taga Concepcion Grande, report ko lang na livelihood program for mothers.",employment
Kailan po kaya maayos ang Concepcion Grande? suspicious drug related activity po kasi.,public_safety
Reporting a concern regarding cash for work payout delay at San Isidro.,employment
Pwede ba mag-reklamo? cash for work payout delay kasi sa Metropolitan Cathedral. Thanks.,employment
Reporting a concern regarding unpaid overtime pay at Naga City People's Mall.,employment
"Jusko, amoy imbornal ang paligid nanaman sa Del Rosario. Ilang araw na to.",sanitation
Fyi may putol na kable s daan s Balatas.,utilities
"Kami po ay taga Ateneo Avenue, report ko lang na ipis infestation sa public market.",sanitation
Magtatanong lang po regarding tricycle overcharging fare sa Cararayan?,traffic
"Concerned lang po kami sa mga bata, amoy imbornal ang paligid dito sa Igualdad.",sanitation
report ko lng jeepney cutting trip violation d2 s sabng.,traffic
"Sir/Ma'am, pa-check naman po ng Santa Cruz, flu outbreak sa area namin po kasi.",health
Fyi inom s kalsda hnggng madaling araw s Pacol.,public_safety
MAGTATANONG LANG PO REGARDING LOOKING FOR SUMMER JOB FOR STUDENTS SA CAROLINA?,employment
Good day. We are requesting assistance because grabe ang traffic ngayon at San Felipe.,traffic
"Grabe naman, daming lamok, need fumigation dito sa Calauag! Ano na??",health
Reporting a concern regarding street light flickering on and off at Magsaysay Avenue.,utilities
Report ko lng sumabog ng transformer d2 s San Felipe.,utilities
Update po s cash for work payout delay s Del Rosrio? Wala pa action.,employment
I would like to report that medical assistance for indigent in Jesse Robredo Coliseum.,social_services
KAILAN PO KAYA MAAYOS ANG SABANG? STATUS OF SCHOLARSHIP APPLICATION PO KASI.,social_services
Report ko lng calamity loan inquiry d2 s Peñafrancia.,social_services
Report ko lng double parking s main road d2 s San Felipe.,traffic
"Shoutout sa LGU, congested intersection always sa Mabolo. Please actionan agad.",traffic
"Grabe naman, collapsed riprap sa ilog dito sa Sabang! Ano na??",infrastructure
Anyone from city hall? unsanitary street food vendors here in Carolina. So hassle.,sanitation
I would like to report that looking for summer job for students in Panganiban Drive.,employment
"Kami po ay taga Naga City People's Mall, report ko lang na illegal parking sa kalsada.",traffic
Help. high blood pressure monitoring request s Pnganiban Drive. Pls fix.,health
"SIR/MA'AM, PA-CHECK NAMAN PO NG TABUCO, ROAD WIDENING PROJECT DELAY PO KASI.",infrastructure
Pwede ba mag-reklamo? pagtapon ng basura sa ilog kasi sa Sabang. Thanks.,waste_management
"Concerned lang po kami sa mga bata, illegal dismissal complaint dito sa Concepcion Pequeña.",employment
"Shoutout sa LGU, amoy imbornal ang paligid sa Bicol Central Station. Please actionan agad.",sanitation
HELP. NO ENTRY VIOLATION REPORTS S LIBOTON. PLS FIX.,traffic
Gud pm. walng tubig simula kanina s Sabng. Tnx.,utilities
KAILAN PO KAYA MAAYOS ANG SAN FELIPE? UBOS NA ANG GAMOT SA CENTER PO KASI.,health
Concern lng re: collapsed riprap s ilog s Ateneo Avenue.,infrastructure
"Grabe naman, maraming bata ang nilalagnat dito sa Cararayan! Ano na??",health
"Jusko, sobrang hina ng signal nanaman sa Pacol. Ilang araw na to.",utilities
Urgent: vawc desk assistance needed d2 s Abella.,social_services
Parang wala namang action. recycling inquiry pa rin sa Pacol.,waste_management
Pwede ba mag-reklamo? congested intersection always kasi sa Ecology Park. Thanks.,traffic
Update po s unsnitary street food vendors s Diversion Road? Wala pa action.,sanitation
Kailan po kaya maayos ang San Felipe? vawc desk assistance needed po kasi.,social_services
Help. walng segregation policy s Centro. Pls fix.,waste_management
I would like to report that kalat ang basura sa park in Carolina.,waste_management
Kailan po kaya maayos ang UNC gate? vawc desk assistance needed po kasi.,social_services
"Kami po ay taga Plaza Quince, report ko lang na senior citizen pension delay.",social_services
"Shoutout sa LGU, water pipe leak sa kalsada sa UNC gate. Please actionan agad.",utilities
Magtatanong lang po regarding financial aid for poor students sa LCC Mall?,social_services
Magtatanong lang po regarding vandalism sa pader ng school sa Plaza Rizal?,public_safety
Gud pm. public toilet walng tubig at madumi s Dinaga. Tnx.,sanitation
"shoutout sa lgu, street light flickering on and off sa lcc mall. please actionan agad.",utilities
"Concerned lang po kami sa mga bata, financial aid for poor students dito sa Naga City People's Mall.",social_services
Pwede ba mag-reklamo? bulky waste pickup request kasi sa Dayangdang. Thanks.,waste_management
"Ask ko lang po kung may action na, suspicious drug related activity kasi dito sa Calauag.",public_safety
Parang wala namang action. road obstruction by vendors pa rin sa Concepcion Grande.,traffic
Reporting a concern regarding high blood pressure monitoring request at Dinaga.,health
"Grabe naman, sparking wires sa poste dito sa Calauag! Ano na??",utilities
"Kami po ay taga Bagumbayan, report ko lang na kailan ang schedule ng hakot.",waste_management
Parang wala namang action. kulang ang binigay na relief goods pa rin sa Diversion Road.,social_services
"Concerned lang po kami sa mga bata, openings for construction workers dito sa Naga City People's Mall.",employment
Concern lng re: sira ng bubong ng waiting shed s Plaza Quince.,infrastructure
Update po s requesting ambulance assistance s Peñafrancia? Wala pa action.,health
MAGTATANONG LANG PO REGARDING CALAMITY LOAN INQUIRY SA PANICUASON?,social_services
"Sir/Ma'am, pa-check naman po ng LCC Mall, kailan ang schedule ng hakot po kasi.",waste_management
urgent: hindi dumaan ng garbage truck d2 s dayngdng.,waste_management
Help. drag racing ng motor s gabi s Balatas. Pls fix.,public_safety
Report ko lng feeding program request for kids d2 s Naga City People's Mall.,social_services
Huy pansinin niyo naman to. tumataas ang cases ng dengue sa Diversion Road. Nakaka-stress!,health
Report ko lng hindi dumaan ng garbage truck d2 s Metropolitan Cathedral.,waste_management
